{
  "contract_version": "0.4",
  "kind": "instructions",
  "skill": {
    "name": "case",
    "version": "1.0.0"
  },
  "permissions": {
    "read": {
      "level": "none"
    },
    "write": {
      "level": "none"
    },
    "network": {
      "level": "none"
    },
    "exec": {
      "level": "none"
    },
    "spend": {
      "level": "none"
    },
    "send": {
      "level": "none"
    }
  },
  "capabilities": [
    {
      "id": "guide",
      "summary": "guidance only",
      "effects": []
    }
  ]
}
